{
  "id": "e69edd75-7bc1-432f-84bb-cd12d98ddff3",
  "case_number": "NT-20260903-0001",
  "title": "仁愛鄉道路坍方",
  "category": "road_collapse",
  "category_label": "道路坍方",
  "severity": "high",
  "status": "emic_processing",
  "status_label": "處理中",
  "phase": "active",
  "track": "emic",
  "track_label": "上報 EMIC",
  "lat": 24.024,
  "lon": 121.157,
  "town": "仁愛鄉",
  "location_label": "南投縣仁愛鄉台14甲線 18K 一帶",
  "report_count": 3,
  "unique_reporter_count": 3,
  "assigned_unit": "公路局中區養護工程分局埔里工務段",
  "emic_status": "已派員處理",
  "public_summary": "重機具進場清除土石，單線通行預計 2 小時後恢復",
  "created_at": "2026-09-03T06:35:00+00:00",
  "updated_at": "2026-09-03T07:20:00+00:00",
  "reviewed_at": "2026-09-03T06:42:00+00:00",
  "closed_at": null
}
